cod;value
0303010126;TRATAMENTO DE INFECÇåES DE TRANSMISSÇO PREDOMINANTEMENTE SEXUAL (A50 A A64)
0303010134;TRATAMENTO DE INFECÇåES VIRAIS CARACTERIZADAS POR LESåES DE PELE E MUCOSAS (B00 A B09)
0303010142;TRATAMENTO DE INFECÇåES VIRAIS DO SISTEMA NERVOSO CENTRAL
0303010150;TRATAMENTO DE MALÁRIA
0303010169;TRATAMENTO DE MICOSES (B35 A B49)
0303010177;TRATAMENTO DE OUTRAS DOENÇAS CAUSADAS POR CLAMÍDIAS(A70 A A74)
0303010185;TRATAMENTO DE OUTRAS DOENÇAS CAUSADAS POR ESPIROQUETAS (A65 A A69)
0303010193;TRATAMENTO DE OUTRAS DOENÇAS CAUSADAS POR VÍRUS (B25 A B34)
0303010207;TRATAMENTO DE POLIOMIELITE PARALÍTICA AGUDA
0303010215;TRATAMENTO DE TUBERCULOSE (A15 a A19)
0303020016;PULSOTERAPIA I (POR APLICACAO)
0303020024;PULSOTERAPIA II (POR APLICACAO)
0303020032;TRATAMENTO DE ANEMIA APLASTICA E OUTRAS ANEMIAS
0303020040;TRATAMENTO DE ANEMIA HEMOLITICA
0303020059;TRATAMENTO DE ANEMIAS NUTRICIONAIS
0303020067;TRATAMENTO DE DEFEITOS DA COAGULACAO PURPURA E OUTRAS AFECCOES HEMORRAGICAS
0303020075;TRATAMENTO DE HEMOFILIAS
0303020083;TRATAMENTO DE OUTRAS DOENCAS DO SANGUE E DOS ORGAOS HEMATOPOETICOS
0303030011;TRATAMENTO DA FIBROSE CISTICA
0303030020;TRATAMENTO DE DESNUTRICAO
0303030038;TRATAMENTO DE DIABETES MELLITUS
0303030046;TRATAMENTO DE DISTURBIOS METABOLICOS
0303030054;TRATAMENTO DE TRANSTORNOS DA GLANDULA TIREOIDE
0303030062;TRATAMENTO DE TRANSTORNOS DE OUTRAS GLANDULAS ENDOCRINAS
0303030070;ADMINISTRAÇÃO HORMONAL (VALOR MENSAL)
0303030089;TRATAMENTO HORMONAL PREPARATÓRIO PARA CIRURGIA DE REDESIGNAÇÃO SEXUAL NO PROCESSO TRANSEXUALIZADOR
0303030097;TERAPIA HORMONAL NO PROCESSO TRANSEXUALIZADOR
0303040017;AJUSTE MEDICAMENTOSO DE SITUACOES NEUROLOGICAS AGUDIZADAS
0303040025;INTERNACAO P/ O TRATAMENTO MEDICAMENTOSO DA OSTEOGENESIS IMPERFECTA
0303040033;TRATAMENTO DA MIGRANEA COMPLICADA
0303040041;TRATAMENTO CLINICO DE ABSCESSO CEREBRAL
0303040050;TRATAMENTO CLINICO DE COREIA AGUDA
0303040068;TRATAMENTO CONSERVADOR DA DOR REBELDE DE ORIGEM CENTRAL OU NEOPLASICA
0303040076;TRATAMENTO CONSERVADOR DA HEMORRAGIA CEREBRAL
0303040084;TRATAMENTO CONSERVADOR DE TRAUMATISMO CRANIOENCEFALICO (GRAU LEVE)
0303040092;TRATAMENTO CONSERVADOR DE TRAUMATISMO CRANIOENCEFALICO (GRAU MEDIO)
0303040106;TRATAMENTO CONSERVADOR DE TRAUMATISMO CRANIOENCEFALICO GRAVE
0303040114;TRATAMENTO CONSERVADOR DE TRAUMATISMO RAQUIMEDULAR
0303040122;TRATAMENTO CONSERVADOR DE TUMOR DO SISTEMA NERVOSO CENTRAL
0303040130;TRATAMENTO CLINICO DAS MIELITES / MIELOPATIAS
0303040149;TRATAMENTO DE ACIDENTE VASCULAR CEREBRAL - AVC (ISQUEMICO OU HEMORRAGICO AGUDO)
0303040157;TRATAMENTO DE COMPLICACOES DA HIDROCEFALIA
0303040165;TRATAMENTO DE CRISES EPILETICAS NAO CONTROLADAS
0303040173;TRATAMENTO DE DISTROFIAS MUSCULARES
0303040181;TRATAMENTO DE DOENCA DE PARKINSON
0303040190;TRATAMENTO DE DOENCA DOS NEURONIOS MOTORES CENTRAIS C/ OU S/ AMIOTROFIAS
0303040203;TRATAMENTO DE DOENCAS NEURO-DEGENERATIVAS
0303040211;TRATAMENTO DE ENCEFALOPATIA HIPERTENSIVA
0303040220;TRATAMENTO DE ESCLEROSE GENERALIZADA PROGRESSIVA
0303040238;TRATAMENTO DE FRATURA DA COLUNA VERTEBRAL C/ LESAO DA MEDULA ESPINHAL
0303040246;TRATAMENTO DE INTERCORRENCIAS DE DOENCAS NEUROMUSCULARES
0303040254;TRATAMENTO DE MIASTENIA GRAVE
0303040262;TRATAMENTO DE POLINEUROPATIAS
0303040270;TRATAMENTO DE POLIRRADICULONEURITE DESMIELINIZANTE AGUDA
0303040289;TRATAMENTO DE SURTO DE ESCLEROSE MULTIPLA
0303040297;TRATAMENTO DE PROCESSO TOXI-INFECCIOSO DO CEREBRO OU DA MEDULA ESPINHAL
0303040300;TRATAMENTO DO ACIDENTE VASCULAR CEREBRAL ISQUÊMICO AGUDO COM USO DE TROMBOLÍTICO
0303050012;ACOMPANHAMENTO E AVALIACAO DE GLAUCOMA POR FUNDOSCOPIA E TONOMETRIA
0303050020;EXERCICIOS ORTOPTICOS
0303050039;TRATAMENTO OFTALMOLãGICO DE PACIENTE C/ GLAUCOMA BINOCULAR (1¦ LINHA )
0303050047;TRATAMENTO OFTALMOLÓGICO DE PACIENTE C/ GLAUCOMA BINOCULAR (2¦ LINHA)
0303050055;TRATAMENTO OFTALMOLÓGICO DE PACIENTE C/ GLAUCOMA BINOCULAR (3 ¦ LINHA)
0303050063;TRATAMENTO OFTALMOLÓGICO DE PACIENTE C/ GLAUCOMA MONOCULAR (1¦ LINHA )
0303050071;TRATAMENTO OFTALMOLÓGICO DE PACIENTE COM GLAUCOMA MONOCULAR (2¦ LINHA)
0303050080;TRATAMENTO OFTALMOLÓGICO DE PACIENTE COM GLAUCOMA MONOCULAR (3¦ LINHA)
0303050098;TRATAMENTO OFTALMOLOGICO DE PACIENTE COM GLAUCOMA COM DISPENSAÇÃO DE ACETAZOLAMIDA MONOCULAR OU BINO
0303050101;TRATAMENTO OFTALMOLÓGICO DE PACIENTE COM GLAUCOMA COM DISPENSAÇÃO DE PILOCARPINA MONOCULAR
0303050110;TRATAMENTO OFTALMOLÓGICO DE PACIENTE COM GLAUCOMA COM DISPENSAÇÃO DE PILOCARPINA BINOCULAR
0303050128;CONSULTA OFTALMOLÓGICA - PROJETO OLHAR BRASIL
0303050136;TRATAMENTO CLÍNICO DE INTERCORRÊNCIAS OFTALMOLÓGICAS
0303050144;TRATAMENTO CLÍNICO DE INTERCORRÊNCIAS OFTALMOLÓGICAS DE ORIGEM INFECCIOSA
0303050152;TRATAMENTO OFTALMOLÓGICO DE PACIENTE COM GLAUCOMA - 1¦ LINHA ASSOCIADA A 2¦ LINHA - MONOCULAR
0303050160;TRATAMENTO OFTALMOLÓGICO DE PACIENTE COM GLAUCOMA - 1¦ LINHA ASSOCIADA A 2¦ LINHA - BINOCULAR
0303050179;TRATAMENTO OFTALMOLÓGICO DE PACIENTE COM GLAUCOMA - 1¦ LINHA ASSOCIADA A 3¦ LINHA - MONOCULAR
0303050187;TRATAMENTO OFTALMOLÓGICO DE PACIENTE COM GLAUCOMA - 1¦ LINHA ASSOCIADA A 3¦ LINHA - BINOCULAR
0303050195;TRATAMENTO OFTALMOLÓGICO DE PACIENTE COM GLAUCOMA - 2¦ LINHA ASSOCIADA A 3¦ LINHA - MONOCULAR
0303050209;TRATAMENTO OFTALMOLÓGICO DE PACIENTE COM GLAUCOMA - 2¦ LINHA ASSOCIADA A 3¦ LINHA - BINOCULAR
0303050217;TRATAMENTO OFTALMOLÓGICO DE PACIENTE COM GLAUCOMA MONOCULAR- ASSOCIAÇÃO DE 1¦, 2¦ E 3¦ LINHAS
0303050225;TRATAMENTO OFTALMOLÓGICO DE PACIENTE COM GLAUCOMA BINOCULAR - ASSOCIAÇÃO 1¦, 2¦ E 3¦ LINHAS
0303050233;TRATAMENTO MEDICAMENTOSO DA DOENÇA DA RETINA
0303060018;TRATAMENTO DE ANEURISMA DA AORTA
0303060026;TRATAMENTO DE ARRITMIAS
0303060034;TRATAMENTO DE CARDIOPATIA HIPERTROFICA
0303060042;TRATAMENTO DE CARDIOPATIA ISQUEMICA CRONICA
0303060050;TRATAMENTO DE CHOQUE ANAFILATICO
0303060069;TRATAMENTO DE CHOQUE CARDIOGENICO
0303060077;TRATAMENTO DE CHOQUE HIPOVOLEMICO
0303060085;TRATAMENTO DE COMPLICACOES CARDIACAS POS-CIRURGIA
0303060093;TRATAMENTO DE COMPLICACOES DE DISPOSITIVOS PROTETICOS IMPLANTES E ENXERTOS CARDIACOS E VALVULARES
0303060107;TRATAMENTO DE CRISE HIPERTENSIVA
0303060115;TRATAMENTO DE DOENCA REUMATICA C/ COMPROMETIMENTO CARDIACO
0303060123;TRATAMENTO DE DOENCA REUMATICA S/ CARDITE
0303060131;TRATAMENTO DE EDEMA AGUDO DE PULMAO
0303060140;TRATAMENTO DE EMBOLIA PULMONAR
0303060158;TRATAMENTO DE ENDOCARDITE INFECCIOSA EM PROTESE VALVAR
0303060166;TRATAMENTO DE ENDOCARDITE INFECCIOSA EM VALVULA NATIVA
0303060174;TRATAMENTO DE HIPERTENSAO PULMONAR
0303060182;TRATAMENTO DE HIPERTENSAO SECUNDARIA
0303060190;TRATAMENTO DE INFARTO AGUDO DO MIOCÁRDIO
0303060204;TRATAMENTO DE INSUFICIENCIA ARTERIAL C/ ISQUEMIA CRITICA
0303060212;TRATAMENTO DE INSUFICIENCIA CARDIACA
0303060220;TRATAMENTO DE LINFADENITES INESPECIFICAS
0303060239;TRATAMENTO DE MIOCARDIOPATIAS
0303060247;TRATAMENTO DE OUTRAS VASCULOPATIAS
0303060255;TRATAMENTO DE PARADA CARDIACA C/ RESSUSCITACAO
0303060263;TRATAMENTO DE PE DIABETICO COMPLICADO
0303060271;TRATAMENTO DE PERICARDITE
0303060280;TRATAMENTO DE SINDROME CORONARIANA AGUDA
0303060298;TRATAMENTO DE TROMBOSE VENOSA PROFUNDA
0303060301;TRATAMENTO DE VARIZES DOS MEMBROS INFERIORES C/ ULCERA
0303070013;DILATACAO DE ESOFAGO C/ OGIVAS SOB VISAO ENDOSCOPICA (POR SESSAO)
0303070021;HEMOPERFUSAO
0303070030;REMOCAO MANUAL DE FECALOMA
0303070048;RETIRADA DE CORPO ESTRANHO DO ESOFAGO
0303070056;RETIRADA DE CORPO ESTRANHO DO ESTOMAGO / DUODENO
0303070064;TRATAMENTO DE DOENCAS DO ESOFAGO ESTOMAGO E DUODENO
0303070072;TRATAMENTO DE DOENCAS DO FIGADO
0303070080;TRATAMENTO DE DOENCAS DO PERITONIO
0303070099;TRATAMENTO DE ENTERITES E COLITES NAO INFECCIOSAS
0303070102;TRATAMENTO DE OUTRAS DOENCAS DO APARELHO DIGESTIVO
0303070110;TRATAMENTO DE OUTRAS DOENCAS DO INTESTINO
0303070129;TRATAMENTO DE TRANSTORNOS DAS VIAS BILIARES E PANCREAS
0303070137;TRATAMENTO DE INTERCORRENCIA CLINICA PÓS-CIRURGIA BARIATRICA
0303080019;CAUTERIZACAO QUIMICA DE PEQUENAS LESOES
0303080027;DESBASTAMENTO DE CALOSIDADE E/OU MAL PERFURANTE (DESBASTAMENTO)
0303080035;ESFOLIACAO QUIMICA
0303080043;TRATAMENTO DE AFECCOES BOLHOSAS
0303080051;TRATAMENTO DE DERMATITES E ECZEMAS
0303080060;TRATAMENTO DE ESTAFILOCOCCIAS
0303080078;TRATAMENTO DE ESTREPTOCOCCIAS
0303080086;TRATAMENTO DE FARMACODERMIAS
0303080094;TRATAMENTO DE OUTRAS AFECCOES DA PELE E DO TECIDO SUBCUTANEO
0303080108;FOTOTERAPIA (POR SESSAO)
0303080116;FOTOTERAPIA COM FOTOSSENSIBILIZAÇÃO (POR SESSAO)
0303090014;ARTROCENTESE DE GRANDES ARTICULACOES
0303090022;ARTROCENTESE DE PEQUENAS ARTICULACOES
0303090030;INFILTRACAO DE SUBSTANCIAS EM CAVIDADE SINOVIAL (ARTICULACAO, BAINHA TENDINOSA)
0303090049;INSTALACAO DE TRACAO CUTANEA
0303090073;REVISÇO COM TROCA DE APARELHO GESSADO EM MEMBRO INFERIOR
0303090081;REVISÇO COM IMOBILIZAÇÃO NÇO GESSADA EM LESÇO DA COLUNA VERTEBRAL
0303090090;REVISÇO COM TROCA DE APARELHO GESSADO EM MEMBRO SUPERIOR
0303090111;REVISÇO COM TROCA DE APARELHO GESSADO EM LESÇO DA COLUNA VERTEBRAL
0303090120;TRATAMENTO CONSERVADOR DE FRATURA NA CINTURA ESCAPULAR (COM IMOBILIZAÇÃO)
0303090138;TRATAMENTO CONSERVADOR DE FRATURA / LESAO LIGAMENTAR / ARRANCAMENTO OSSEO AO NIVEL DA PELVE
0303090146;TRATAMENTO CONSERVADOR DE FRATURA DE COSTELAS
0303090154;TRATAMENTO CONSERVADOR DE FRATURA DE PUNHO COM LUVA GESSADA
0303090162;TRATAMENTO CONSERVADOR DE FRATURA DE OSSO METACÁRPICO
0303090170;TRATAMENTO CONSERVADOR DE FRATURA DE OSSOS DA FACE
0303090189;TRATAMENTO CONSERVADOR DE FRATURA DO ESTERNO
0303090197;TRATAMENTO CONSERVADOR DE FRATURA DOS ANEIS PELVICOS
0303090200;TRATAMENTO CONSERVADOR DE FRATURA EM MEMBRO INFERIOR COM IMOBILIZAÇÃO
0303090219;TRATAMENTO CONSERVADOR DE LESÇO DA COLUNA CERVICAL COM IMOBILIZAÇÃO
0303090227;TRATAMENTO CONSERVADOR DE FRATURA EM MEMBRO SUPERIOR COM IMOBILIZAÇÃO
0303090235;TRATAMENTO CONSERVADOR DE LESAO DA COLUNA TORACO-LOMBO-SACRA C/ ORTESE
0303090243;TRATAMENTO CONSERVADOR DE LESAO DA COLUNA TORACO-LOMBO-SACRA S/ IMOBILIZACAO
0303090251;TRATAMENTO CONSERVADOR DE LESÇO DE COLUNA TORACO-LOMBO-SACRA COM IMOBILIZAÇÃO
0303090260;TRATAMENTO CONSERVADOR DE LESÇO DE MECANISMO EXTENSOR DOS DEDOS
0303090286;TRATAMENTO CONSERVADOR DE LESÇO LIGAMENTAR EM MEMBRO COM IMOBILIZAÇÃO
0303090294;TRATAMENTO CONSERVADOR DE LUMBAGO OU DORSALGIA REFRATARIOS
0303090308;TRATAMENTO CONSERVADOR DE OSTEOMIELITE AGUDA
0303090316;TRATAMENTO DAS POLIARTROPATIAS INFLAMATORIAS
0303090324;TRATAMENTO DE ARTRITE REUMATOIDE
0303090332;TRATAMENTO DE DOENCAS SISTEMICAS DO TECIDO CONJUNTIVO
0303090340;TRATAMENTO DE ESPONDILITE ANCILOSANTE
0303090359;TRATAMENTO DE OSTEITE
0303090367;TRATAMENTO DE OSTEOPOROSE
0303090375;TRATAMENTO DE OUTRAS DOENCAS OSSEAS
0303100010;TRATAMENTO DE COMPLICACOES RELACIONADAS PREDOMINANTEMENTE AO PUERPERIO
0303100028;TRATAMENTO DE ECLAMPSIA
0303100036;TRATAMENTO DE EDEMA, PROTEINURIA E TRANSTORNOS HIPERTENSIVOS NA GRAVIDEZ PARTO E PUERPERIO
0303100044;TRATAMENTO DE INTERCORRENCIAS CLINICAS NA GRAVIDEZ
0303100052;TRATAMENTO DE MOLA HIDATIFORME
0303110015;TRATAMENTO DAS MALFORMACOES E DEFORMIDADES CONGENITAS DO SISTEMA OSTEOMUSCULAR
0303110023;TRATAMENTO DE ANOMALIAS CROMOSSOMICAS NAO CLASSIFICADAS EM OUTRA PARTE
0303110031;TRATAMENTO DE ESPINHA BIFIDA
0303110040;TRATAMENTO DE MALFORMACOES CONGENITAS DO APARELHO CIRCULATORIO
0303110058;TRATAMENTO DE FENDA LABIAL E/OU FENDA PALATINA
0303110066;TRATAMENTO DE MALFORMACOES CONGENITAS DO APARELHO URINARIO
0303110074;TRATAMENTO DE MALFORMACOES CONGENITAS DOS ORGAOS GENITAIS
0303110082;TRATAMENTO DE NEUROFIBROMATOSE
0303110090;TRATAMENTO DE OUTRAS ANOMALIAS CONGENITAS DO SISTEMA NERVOSO
0303110104;TRATAMENTO DE OUTRAS MALFORMACOES CONGENITAS
0303110112;TRATAMENTO DE OUTRAS MALFORMACOES CONGENITAS DO APARELHO DIGESTIVO
0303120010;IODOTERAPIA DE CARCIOMA DIFERENCIADO DA TIREOIDE (250 MCI)
0303120029;TRATAMENTO DE CARCINOMA DA TIREOIDE
0303120037;TRATAMENTO DE HIPERTIROIDISMO
0303120045;TRATAMENTO DE CARDIOTOXICOSE POR HIPERTIROIDISMO (ATE 50 MCI)
0303120053;TRATAMENTO DE DOR/METÁSTASE ÓSSEA COM RADIOISÓTOPO (POR TRATAMENTO-EXCETO CÂNCER DE TIREOIDE)
0303120061;TRATAMENTO DE HIPERTIREOIDISMO (PLUMMER - ATE 30 MCI)
0303120070;TRATAMENTO DE HIPERTIREOIDISMO GRAVES
0303130016;ATENDIMENTO A PACIENTE SOB CUIDADOS PROLONGADOS DEVIDO A CAUSAS EXTERNAS
0303130024;ATENDIMENTO A PACIENTE SOB CUIDADOS PROLONGADOS POR ENFERMIDADES CARDIOVASCULARES
0303130032;ATENDIMENTO A PACIENTE SOB CUIDADOS PROLONGADOS POR ENFERMIDADES PNEUMOLOGICAS
0303130040;TRATAMENTO DE PACIENTE SOB CUIDADOS PROLONGADOS POR ENFERMIDADES DECORRENTES DA AIDS
0303130059;TRATAMENTO DE PACIENTE SOB CUIDADOS PROLONGADOS POR ENFERMIDADES NEUROLOGICAS
0303130067;TRATAMENTO DE PACIENTE SOB CUIDADOS PROLONGADOS POR ENFERMIDADES ONCOLOGICAS
0303130075;TRATAMENTO DE PACIENTE SOB CUIDADOS PROLONGADOS POR ENFERMIDADES OSTEOMUSCULARES E DO TECIDO CONJUNT
0303130083;TRATAMENTO DE PACIENTES SOB CUIDADOS PROLONGADOS EM HANSENIASE
0303140011;LAVAGEM NASAL PELO METODO DE PROETZ (POR SESSAO)
0303140020;TRATAMENTO DA FIBROSE CISTICA COM MANIFESTACOES PULMONARES
0303140038;TRATAMENTO DAS AFECCOES NECROTICAS E SUPURATIVAS DAS VIAS AEREAS INFERIORES
0303140046;TRATAMENTO DAS DOENCAS CRONICAS DAS VIAS AEREAS INFERIORES
0303140054;TRATAMENTO DAS DOENCAS PULMONARES DEVIDO A AGENTES EXTERNOS
0303140062;TRATAMENTO DE CARDIOPATIA PULMONAR NAO ESPECIFICADA (COR PULMONALE)
0303140070;TRATAMENTO DE DOENCA DO OUVIDO EXTERNO MEDIO E DA MASTOIDE
0303140089;TRATAMENTO DE DOENCAS RESPIRATORIAS QUE AFETAM PRINCIPALMENTE O INTERSTICIO
0303140097;TRATAMENTO DE HEMORRAGIAS DAS VIAS RESPIRATORIAS
0303140100;TRATAMENTO DE INFECCOES AGUDAS DAS VIAS AEREAS SUPERIORES
0303140119;TRATAMENTO DE OUTRAS DOENCAS DA PLEURA
0303140127;TRATAMENTO DE OUTRAS DOENCAS DAS VIAS AEREAS SUPERIORES
0303140135;TRATAMENTO DE OUTRAS DOENCAS DO APARELHO RESPIRATORIO
0303140143;TRATAMENTO DE OUTRAS INFECCOES AGUDAS DAS VIAS AEREAS INFERIORES
0303140151;TRATAMENTO DE PNEUMONIAS OU INFLUENZA (GRIPE)
0303150017;TRATAMENTO DE DOENCAS DOS ORGAOS GENITAIS MASCULINOS
0303150025;TRATAMENTO DE DOENCAS GLOMERULARES
0303150033;TRATAMENTO DE DOENCAS INFLAMATORIAS DOS ORGAOS PELVICOS FEMININOS
0303150041;TRATAMENTO DE DOENCAS RENAIS TUBULO-INTERSTICIAIS
0303150050;TRATAMENTO DE OUTRAS DOENCAS DO APARELHO URINARIO
0303150068;TRATAMENTO DE OUTROS TRANSTORNOS DO RIM E DO URETER
0303160012;TRATAMENTO DE ENTERITE NECROSANTE DO FETO E DO RECEM-NASCIDO
0303160020;TRATAMENTO DE INFECCOES ESPECIFICAS DO PERIODO PERINATAL
0303160039;TRATAMENTO DE OUTROS TRANSTORNOS ORIGINADOS NO PERIODO PERINATAL
0303160047;TRATAMENTO DE TRANSTORNOS HEMORRAGICOS E HEMATOLOGICOS DO FETO E DO RECEM-NASCIDO
0303160055;TRATAMENTO DE TRANSTORNOS RELACIONADOS C/ A DURACAO DA GESTACAO E C/ O CRESCIMENTO FETAL
0303160063;TRATAMENTO DE TRANSTORNOS RESPIRATORIOS E CARDIOVASCULARES ESPECIFICOS DO PERIODO NEONATAL
0303160071;TRATAMENTO DE TRAUMATISMO DE PARTO NO NEONATO
0303170018;DIAGNOSTICO E/OU ATENDIMENTO DE URGENCIA EM PSIQUIATRIA
0303170026;TRATAMENTO DA INTOXICACAO AGUDA EM USUARIOS DE ALCOOL E OUTRAS DROGAS
0303170034;TRATAMENTO DA SINDROME DE ABSTINENCIA DO ALCOOL EM SERVICO HOSPITALAR DE REFERENCIA PARA A ATENCAO I
0303170042;TRATAMENTO DE DEPENDENCIA DO ALCOOL EM SERVICO HOSPITALAR DE REFERENCIA PARA A ATENCAO INTEGRAL AOS
0303170050;TRATAMENTO DE SINDROME DE ABSTINENCIA POR USO PREJUDICIAL DE ALCOOL E DROGAS
0303170069;TRATAMENTO DE TRANSTORNOS MENTAIS E COMPORTAMENTAIS DEVIDOS AO USO DE SUBSTANCIAS PSICOATIVAS
0303170077;TRATAMENTO EM PSIQUIATRIA (CLASSIFICACAO PT GM 251/02)
0303170085;TRATAMENTO EM PSIQUIATRIA - EM HOSPITAL GERAL (POR DIA)
0303170093;TRATAMENTO EM PSIQUIATRIA (POR DIA)
0303170107;TRATAMENTO EM PSIQUIATRIA EM HOSPITAL DIA
0303170115;TRATAMENTO A PACIENTES QUE FAZEM USO DE COCAÍNA E DERIVADOS EM HOSPITAL DE REFERÊNCIA PARA ATENÇÃO I
0303170123;TRATAMENTO DE PACIENTES QUE FAZEM USO DE COCAÍNA E DERIVADOS COM COMORBIDADE EM HOSPITAL DE REFERÊNC
0303170131;TRATAMENTO CLÍNICO EM SAÚDE MENTAL EM SITUAÇÃO DE RISCO ELEVADO DE SUICÍDIO.
0303170140;TRATAMENTO CLÍNICO PARA CONTENÇÃO DE COMPORTAMENTO DESORGANIZADO E/OU DISRUPTIVO
0303170158;TRATAMENTO CLÍNICO PARA AVALIAÇÃO DIAGNÓSTICA E ADEQUAÇÃO TERAPÊUTICA, INCLUINDO NECESSIDADES DE SAÚ
0303170166;TRATAMENTO CLÍNICO DE TRANSTORNOS MENTAIS E COMPORTAMENTAIS DEVIDO AO USO DE ÁLCOOL
0303170174;"TRATAMENTO CLÍNICO DE TRANSTORNOS MENTAIS E COMPORTAMENTAIS DEVIDO AO USO DE ""CRACK""."
0303170182;TRATAMENTO CLÍNICO DOS TRANSTORNOS MENTAIS E COMPORTAMENTAIS DEVIDO AO USO DAS DEMAIS DROGAS E/OU OU
0303170190;TRATAMENTO EM PSIQUIATRIA DE CURTA PERMANENCIA POR DIA (PERMANENCIA ATÉ 90 DIAS)
0303170204;TRATAMENTO EM PSIQUIATRIA POR DIA (COM DURAÇÃO SUPERIOR A 90 DIAS DE INTERNAÇÃO OU REINTERNAÇÃO ANTE
0303180013;TRATAMENTO DE AFECÇåES ASSOCIADAS AO HIV/AIDS
0303180030;TRATAMENTO DE AFECÇåES DO APARELHO DIGESTIVO EM HIV/AIDS
0303180048;TRATAMENTO DE AFECÇåES DO SISTEMA NERVOSO EM HIV/AIDS
0303180056;TRATAMENTO DE AFECÇåES DO SISTEMA RESPIRATÓRIO EM HIV/AIDS
0303180064;TRATAMENTO DE DOENÇAS DISSEMINADAS EM AIDS
0303180072;TRATAMENTO DE HIV / AIDS
0303190019;TRATAMENTO EM REABILITACAO
0304010014;BETATERAPIA DÉRMICA (POR CAMPO)
0304010022;BETATERAPIA OFTÁLMICA (POR CAMPO)
0304010030;BETATERAPIA PARA PROFILAXIA DE PTERÍGIO (POR CAMPO)
0304010049;BRAQUITERAPIA
0304010057;BRAQUITERAPIA COM FIOS DE IRIDIUM
0304010065;BRAQUITERAPIA COM IODO 125 / OURO 198
0304010073;BRAQUITERAPIA DE ALTA TAXA DE DOSE (POR INSERÇÃO)
0304010081;VERIFICAÇÂO POR IMAGEM EM RADIOTERAPIA
0304010090;COBALTOTERAPIA (POR CAMPO)
0304010103;IMPLANTAÇÃO DE HALO PARA RADIOCIRURGIA
0304010111;INTERNACAO P/ RADIOTERAPIA EXTERNA (COBALTOTERAPIA / ACELERADOR LINEAR)
0304010120;IRRADIACAO DE CORPO INTEIRO PRÉ-TRANSPLANTE DE MEDULA ÓSSEA
0304010138;IRRADIAÇÃO DE MEIO CORPO
0304010146;IRRADIAÇÃO DE PELE TOTAL
0304010154;MÁSCARA / IMOBILIZAÇÃO PERSONALIZADA (POR TRATAMENTO)
0304010162;MOLDAGEM EM COLO E/OU CORPO DO UTERO
0304010170;NARCOSE DE CRIANÇA (POR PROCEDIMENTO)
0304010189;PLANEJAMENTO COMPLEXO (POR TRATAMENTO)
0304010197;PLANEJAMENTO DE BRAQUITERAPIA DE ALTA TAXA DE DOSE (POR TRATAMENTO)
0304010200;PLANEJAMENTO SIMPLES (POR TRATAMENTO)
0304010219;RADIOCIRURGIA - UM ISOCENTRO
0304010227;RADIOCIRURGIA POR GAMA-KNIFE - HUM ISOCENTRO
0304010235;RADIOTERAPIA DE DOENÇA OU CONDIÇÃO BENIGNA (POR CAMPO)
0304010243;RADIOTERAPIA ESTEREOTÁXICA FRACIONADA
0304010251;RADIOTERAPIA P/ PROFILAXIA DE QUELOIDE (POR CAMPO)
0304010260;ROENTGENTERAPIA (POR CAMPO)
0304010278;ROENTGENTERAPIA PROFUNDA 150-500 KV (POR CAMPO-MAXIMO DE 30 POR AREA)
0304010286;RADIOTERAPIA COM ACELERADOR LINEAR SÓ DE FÓTONS (POR CAMPO)
0304010294;RADIOTERAPIA COM ACELERADOR LINEAR DE FÓTONS E ELÉTRONS (POR CAMPO)
0304010308;COLIMAÇÃO PERSONALIZADA
0304010316;PLANEJAMENTO TRIDIMENSIONAL (POR TRATAMENTO).
0304010324;MOLDAGEM/IMPLANTE EM MUCOSA (POR TRATAMENTO COMPLETO)
0304010332;MOLDAGEM/IMPLANTE EM PELE/MUCOSA (POR TRATAMENTO COMPLETO)
0304010340;NARCOSE PARA BRAQUITERAPIA DE ALTA DOSE (POR PROCEDIMENTO)
0304010359;INTERNAÇÃO VIA CNRAC PARA RADIOCIRURGIA OU RADIOTERAPIA ESTEREOTÁXICA FRACIONADA
0304020010;QUIMIOTERAPIA DO ADENOCARCINOMA DE COLON AVANÇADO -1¦ LINHA
0304020028;QUIMIOTERAPIA DO ADENOCARCINOMA DE COLON AVANÇADO - 2¦ LINHA
0304020036;HORMONIOTERAPIA DO ADENOCARCINOMA DE ENDOMÉTRIO AVANÇADO
0304020044;QUIMIOTERAPIA DO ADENOCARCINOMA DE ESTâMAGO AVANÇADO
0304020052;QUIMIOTERAPIA DO ADENOCARCINOMA DE PÂNCREAS AVANÇADO
0304020060;HORMONIOTERAPIA DO ADENOCARCINOMA DE PRÓSTATA AVANÇADO - 2¦ LINHA
0304020079;HORMONIOTERAPIA DO ADENOCARCINOMA DE PRÓSTATA AVANÇADO - 1¦ LINHA
0304020087;QUIMIOTERAPIA DO ADENOCARCINOMA DE PRÓSTATA RESISTENTE A HORMONIOTERAPIA
0304020095;QUIMIOTERAPIA DO CARCINOMA DE RETO AVANÇADO -1¦ LINHA
0304020109;QUIMIOTERAPIA DO CARCINOMA DE RETO AVANÇADO - 2¦ LINHA
0304020117;QUIMIOTERAPIA DO APUDOMA/TUMOR NEUROENDÓCRINO AVANÇADO
0304020125;QUIMIOTERAPIA DO CARCINOMA DE ADRENAL AVANÇADO
0304020133;QUIMIOTERAPIA DO CARCINOMA DE MAMA AVANÇADO -1¦ LINHA
0304020141;QUIMIOTERAPIA DO CARCINOMA DE MAMA AVANÇADO - 2¦ LINHA
0304020150;QUIMIOTERAPIA DO CARCINOMA DE NASOFARINGE AVANÇADO
0304020168;QUIMIOTERAPIA DO CARCINOMA DE RIM AVANÇADO
0304020176;QUIMIOTERAPIA DO CARCINOMA EPIDERMÓIDE / ADENOCARCINOMA DE ESâFAGO AVANÇADO
0304020184;QUIMIOTERAPIA DO CARCINOMA EPIDERMÓIDE / ADENOCARCINOMA DO COLO OU DO CORPO UTERINO AVANÇADO
0304020192;QUIMIOTERAPIA DO CARCINOMA EPIDERMÓIDE DE RETO/ CANAL ANAL/ MARGEM ANAL AVANÇADO
0304020206;QUIMIOTERAPIA DO CARCINOMA EPIDERMÓIDE DE CABEÇA E PESCOÇO AVANÇADO
0304020214;QUIMIOTERAPIA DO CARCINOMA PULMONAR DE CÉLULAS NÇO PEQUENAS AVANÇADO
0304020222;QUIMIOTERAPIA DO CARCINOMA PULMONAR INDIFERENCIADO DE CÉLULAS PEQUENAS AVANÇADO
0304020230;QUIMIOTERAPIA DO MELANOMA MALIGNO AVANÇADO
0304020249;QUIMIOTERAPIA DE METÁSTASE DE ADENOCARCINOMA DE ORIGEM DESCONHECIDA
0304020257;QUIMIOTERAPIA DE METÁSTASE DE CARCINOMA EPIDERMÓIDE/CARCINOMA NEUROENDOCRINO DE ORIGEM DESCONHECIDA
0304020265;QUIMIOTERAPIA DE METÁSTASE DE NEOPLASIA MALIGNA INDIFERENCIADA DE ORIGEM DESCONHECIDA
0304020273;QUIMIOTERAPIA DE NEOPLASIA MALIGNA EPITELIAL DE OVÁRIO OU DE TUBA UTERINA AVANÇADA -1¦ LINHA.
0304020281;QUIMIOTERAPIA DE NEOPLASIA MALIGNA EPITELIAL DE OVÁRIO OU DE TUBA UTERINA AVANÇADA - 2¦ LINHA)
0304020290;QUIMIOTERAPIA DE SARCOMA DE PARTES MOLES AVANÇADO
0304020303;QUIMIOTERAPIA DE SARCOMA ÓSSEO AVANÇADO
0304020311;QUIMIOTERAPIA DO TUMOR DO ESTROMA GASTROINTESTINAL AVANÇADO
0304020320;QUIMIOTERAPIA DE TUMOR DO SISTEMA NERVOSO CENTRAL AVANÇADO
0304020338;HORMONIOTERAPIA DO CARCINOMA DE MAMA AVANÇADO - 2¦ LINHA
0304020346;HORMONIOTERAPIA DO CARCINOMA DE MAMA AVANÇADO- 1¦ LINHA
0304020354;HORMONIOTERAPIA DE CANCER DE MAMA RECEPTOR POSITIVO (2¦ LINHA)
0304020362;QUIMIOTERAPIA DO CARCINOMA DE TIREOIDE AVANÇADO
0304020370;QUIMIOTERAPIA DO CARCINOMA DE PÊNIS AVANÇADO
0304020389;QUIMIOTERAPIA DE CARCINOMA DO FÍGADO OU DO TRATO BILIAR AVANÇADO
0304020397;QUIMIOTERAPIA DE NEOPLASIA MALIGNA DO TIMO AVANÇADA
0304020400;QUIMIOTERAPIA DE CARCINOMA UROTELIAL AVANÇADO
0304020419;POLIQUIMIOTERAPIA DO CARCINOMA DE MAMA HER-2 POSITIVO - 1¦ LINHA
0304020427;MONOQUIMIOTERAPIA DO CARCINOMA DE MAMA HER-2 POSITIVO - 1¦ LINHA
0304020435;POLIQUIMIOTERAPIA COM DUPLO ANTI HER-2 DO CARCINOMA DE MAMA HER-2 POSITIVO 1¦ LINHA
0304020443;QUIMIOTERAPIA COM DUPLO ANTI-HER-2 DO CARCINOMA DE MAMA HER-2 POSITIVO - 1¦ LINHA
0304030015;QUIMIOTERAPIA DE DOENÇA LINFOPROLIFERATIVA RARA -1¦ LINHA.
0304030023;QUIMIOTERAPIA DE DOENÇA LINFOPROLIFERATIVA RARA - 2¦ LINHA
0304030031;QUIMIOTERAPIA DE DOENÇA MIELOPROLIFERATIVA RARA - 1¦ LINHA
0304030040;QUIMIOTERAPIA DE DOENÇA MIELOPROLIFERATIVA RARA - 2¦ LINHA.
0304030058;QUIMIOTERAPIA DE LEUCEMIA LINFOCITICA CRONICA - 1¦ LINHA.
0304030066;QUIMIOTERAPIA DE LEUCEMIA LINFOCITICA CRONICA - 2¦ LINHA.
0304030074;QUIMIOTERAPIA DE LEUCEMIA MIELOIDE CRONICA QUALQUER FASE - CONTROLE SANGINEO
0304030082;QUIMIOTERAPIA DA LEUCEMIA MIELÓIDE CRâNICA EM FASE BLÁSTICA - MARCADOR POSITIVO - 2¦ LINHA.
0304030090;QUIMIOTERAPIA DA LEUCEMIA MIELÓIDE CRâNICA EM FASE BLASTICA - MARCADOR POSITIVO - SEM FASE CRâNICA O
0304030104;QUIMIOTERAPIA DE LEUCEMIA MIELÓIDE CRâNICA EM FASE BLÁSTICA - MARCADOR POSITIVO-3¦ LINHA
0304030112;QUIMIOTERAPIA DA LEUCEMIA MIELÓIDE CRâNICA EM FASE CRâNICA - MARCADOR POSITIVO - 1¦ LINHA.
0304030120;QUIMIOTERAPIA DE LEUCEMIA MIELÓIDE CRâNICA EM FASE CRâNICA - MARCADOR POSITIVO - 3¦ LINHA
0304030139;QUMIOTERAPIA DE LEUCEMIA MIELÓIDE CRâNICA EM FASE DE TRANSFORMAÇÃO - MARCADOR POSITIVO - 3¦ LINHA
0304030147;QUIMIOTERAPIA DA LEUCEMIA MIELÓIDE CRâNICA EM FASE DE TRANSFORMAÇÃO - MARCADOR POSITIVO - 2¦LINHA
0304030155;QUIMIOTERAPIA DE LEUCEMIA MIELÓIDE CRâNICA EM FASE DE TRANSFORMAÇÃO - MARCADOR POSITIVO - SEM FASE C
0304030163;QUIMIOTERAPIA DE LINFOMA NÇO HODGKIN DE BAIXO GRAU DE MALIGNIDADE (1¦ LINHA)
0304030171;QUIMIOTERAPIA DE LINFOMA NÇO HODGKIN DE BAIXO GRAU DE MALIGNIDADE - 2¦LINHA
0304030180;QUIMIOTERAPIA DE NEOPLASIA DE CÉLULAS PLASMÁTICAS - 1¦ LINHA.
0304030198;QUIMIOTERAPIA DE NEOPLASIA DE CÉLULAS PLASMÁTICAS - 2¦ LINHA.
0304030201;QUIMIOTERAPIA DA TRICOLEUCEMIA - 2¦ LINHA
0304030210;QUIMIOTERAPIA DE TRICOLEUCEMIA - 1¦LINHA.
0304030228;QUIMIOTERAPIA DE LEUCEMIA MIELÓIDE CRâNICA EM FASE CRâNICA - MARCADOR POSITIVO - 2¦ LINHA
0304030236;QUIMIOTERAPIA DE LINFOMA FOLICULAR- 1¦ LINHA
0304030244;QUIMIOTERAPIA DE LINFOMA FOLICULAR - 2¦ LINHA
0304040010;QUIMIOTERAPIA DO ADENOCARCINOMA DE RETO (PRÉVIA)
0304040029;QUIMIOTERAPIA DO CARCINOMA DE MAMA (PRÉVIA)
0304040037;QUIMIOTERAPIA DO CARCINOMA DE MAMA EM ESTÁDIO III - 2 ¦ LINHA
0304040045;QUIMIOTERAPIA DO CARCINOMA EPIDERMÓIDE / ADENOCARCINOMA DO COLO UTERINO
0304040053;QUIMIOTERAPIA DO CARCINOMA EPIDERMÓIDE DE RETO/ CANAL ANAL/ MARGEM ANAL
0304040061;QUIMIOTERAPIA DO CARCINOMA EPIDERMÓIDE DE SEIO PARA-NASAL/ LARINGE / HIPOFARINGE/ OROFARINGE /CAVIDA
0304040070;QUIMIOTERAPIA DO CARCINOMA DE BEXIGA
0304040088;QUIMIOTERAPIA DO CARCINOMA DE NASOFARINGE
0304040096;QUIMIOTERAPIA DO CARCINOMA PULMONAR DE CÉLULAS NÇO PEQUENAS (PRÉVIA)
0304040100;QUIMIOTERAPIA DO CARCINOMA PULMONAR INDIFERENCIADO DE CÉLULAS PEQUENAS (PRÉVIA)
0304040118;QUIMIOTERAPIA DE CARCINOMA EPIDERMÓIDE / ADENOCARCINOMA DE ESâFAGO
0304040126;QUIMIOTERAPIA DO CARCINOMA EPIDERMOIDE DE VULVA
0304040134;QUIMIOTERAPIA DE NEOPLASIA MALIGNA EPITELIAL DE OVÁRIO OU DA TUBA UTERINA - 2¦ LINHA
0304040142;QUIMIOTERAPIA DE NEOPLASIA MALIGNA EPITELIAL DE OVÁRIO OU DA TUBA UTERINA - 1¦ LINHA
0304040150;QUIMIOTERAPIA DE OSTEOSSARCOMA - 2¦ LINHA.
0304040169;QUIMIOTERAPIA DE SARCOMA ÓSSEO / OSTEOSSARCOMA - 1¦ LINHA
0304040177;QUIMIOTERAPIA DO ADENOCARCINOMA DE ESTâMAGO (PRÉ-OPERATÓRIA)
0304040185;POLIQUIMIOTERAPIA DO CARCINOMA DE MAMA HER-2 POSITIVO EM ESTÁDIO III (PRÉVIA)
