cod;value
0101010010;ATIVIDADE EDUCATIVA / ORIENTAÇÃO EM GRUPO NA ATENÇÃO BÁSICA
0101010028;ATIVIDADE EDUCATIVA / ORIENTAÇÃO EM GRUPO NA ATENÇÃO ESPECIALIZADA
0101010036;PRÁTICA CORPORAL / ATIVIDADE FÍSICA EM GRUPO
0101010044;PRÁTICAS CORPORAIS EM MEDICINA TRADICIONAL CHINESA
0101010052;TERAPIA COMUNITARIA
0101010060;DANÇA CIRCULAR/BIODANÇA
0101010079;YOGA
0101010087;OFICINA DE MASSAGEM/ AUTO-MASSAGEM
0101020015;AÇÃO COLETIVA DE APLICAÇÃO TÓPICA DE FLÚOR GEL
0101020023;AÇÃO COLETIVA DE BOCHECHO FLUORADO
0101020031;AÇÃO COLETIVA DE ESCOVAÇÃO DENTAL SUPERVISIONADA
0101020040;AÇÃO COLETIVA DE EXAME BUCAL COM FINALIDADE EPIDEMIOLÓGICA
0101020058;APLICAÇÃO DE CARIOSTÁTICO (POR DENTE)
0101020066;APLICAÇÃO DE SELANTE (POR DENTE)
0101020074;APLICAÇÃO TÓPICA DE FLÚOR (INDIVIDUAL POR SESSÃO)
0101020082;EVIDENCIAÇÃO DE PLACA BACTERIANA
0101020090;SELAMENTO PROVISÓRIO DE CAVIDADE DENTÁRIA
0101030010;VISITA DOMICILIAR POR PROFISSIONAL DE NÍVEL MÉDIO
0101030029;VISITA DOMICILIAR/INSTITUCIONAL POR PROFISSIONAL DE NÍVEL SUPERIOR
0101040016;APLICAÇÃO DE SUPLEMENTOS DE MICRONUTRIENTES
0101040024;AVALIAÇÃO ANTROPOMÉTRICA
0101040032;COLETA EXTERNA DE LEITE MATERNO (POR DOADORA)
0101040040;PASTEURIZAÇÃO DO LEITE HUMANO (CADA 5 LITROS)
0101040059;ADMINISTRAÇÃO DE VITAMINA A
0101040067;APLICAÇÃO DE SUPLEMENTOS DE MICRONUTRIENTES
0101050011;PRATICAS CORPORAIS EM MEDICINA TRADICIONAL CHINESA
0101050020;TERAPIA COMUNITÁRIA
0101050038;DANÇA CIRCULAR/BIODANÇA
0101050046;YOGA
0101050054;OFICINA DE MASSAGEM/ AUTO-MASSAGEM
0101050062;SESSÃO DE ARTETERAPIA
0101050070;SESSÃO DE MEDITAÇÃO
0101050089;SESSÃO DE MUSICOTERAPIA
0101050097;SESSÃO DE ANTROPOSOFIA APLICADA - SAÚDE
0101050100;SESSÃO DE BIODANÇA
0101050119;SESSÃO DE BIOENERGÉTICA
0101050127;SESSÃO DE CONSTELAÇÃO FAMILIAR
0101050135;SESSÃO DE DANÇA CIRCULAR
0101050143;SESSÃO DE TERMALISMO
0102010013;APLICACAO DE MULTA
0102010021;APLICACAO DE ADVERTENCIA
0102010030;APLICACAO DE INTERDICAO DE PRODUTO
0102010048;APLICACAO DE INTERDICAO PARCIAL / TOTAL DE ESTABELECIMENTO
0102010056;ATIVIDADES EDUCATIVAS PARA O SETOR REGULADO
0102010064;ANÁLISE DE PROJETOS BÁSICOS DE ARQUITETURA
0102010072;CADASTRO DE ESTABELECIMENTOS SUJEITOS - VIGILÂNCIA SANITÁRIA
0102010080;CANCELAMENTO DE ALVARA DE LICENCIAMENTO SANITARIO P/ ESTABELECIMENTO DE SAUDE
0102010099;CANCELAMENTO DE ALVARA DE LICENCIAMENTO SANITARIO P/ ESTABELECIMENTO EXCETO OS DE SAUDE
0102010102;COLETA DE AMOSTRA P/ ANALISE DE CONTROLE
0102010110;COLETA DE AMOSTRA P/ ANALISE FISCAL
0102010129;EMISSAO DE ALVARA DE LICENCIAMENTO SANITARIO P/ ESTABELECIMENTO DE SAUDE
0102010137;EMISSAO DE ALVARA DE LICENCIAMENTO SANITARIO P/ ESTABELECIMENTO EXCETO OS DE SAUDE
0102010145;INSPEÇÃO SANITÁRIA DE HOSPITAIS
0102010153;INVESTIGAÇÃO DE EVENTOS ADVERSOS E/OU QUEIXAS TÉCNICAS
0102010161;EXCLUSÇO DE CADASTRO DE ESTABELECIMENTOS SUJEITOS - VIGILÂNCIA SANITÁRIA COM ATIVIDADES ENCERRADAS.
0102010170;INSPEÇÃO DOS ESTABELECIMENTOS SUJEITOS - VIGILÂNCIA SANITÁRIA
0102010188;LICENCIAMENTO DOS ESTABELECIMENTOS SUJEITOS - VIGILÂNCIA SANITÁRIA
0102010196;APROVAÇÃO DE PROJETOS BÁSICOS DE ARQUITETURA
0102010200;INVESTIGAÇÃO DE SURTOS DE DOENÇAS TRANSMITIDAS POR ALIMENTOS
0102010218;INVESTIGAÇÃO DE SURTOS DE INFECÇÃO EM SERVIÇOS DE SAÚDE
0102010226;ATIVIDADE EDUCATIVA PARA A POPULAÇÃO
0102010234;RECEBIMENTO DE DENÚNCIAS/RECLAMAÇåES
0102010242;ATENDIMENTO - DENÚNCIAS/RECLAMAÇåES
0102010250;CADASTRO DE HOSPITAIS
0102010269;LICENCIAMENTO SANITÁRIO DE HOSPITAIS
0102010277;CADASTRO DE INSTITUIÇåES DE LONGA PERMANÊNCIA PARA IDOSOS
0102010285;INSPEÇÃO SANITÁRIA DE INSTITUIÇåES DE LONGA PERMANÊNCIA PARA IDOSOS
0102010293;LICENCIAMENTO SANITÁRIO DE INSTITUIÇåES DE LONGA PERMANÊNCIA PARA IDOSOS
0102010307;CADASTRO DE INDÚSTRIAS DE MEDICAMENTOS
0102010315;INSPEÇÃO SANITÁRIA DE INDÚSTRIA DE MEDICAMENTOS
0102010323;LICENCIAMENTO SANITÁRIO DE INDÚSTRIAS DE MEDICAMENTOS
0102010331;CADASTRO DE SERVIÇOS DE DIAGNÓSTICO E TRATAMENTO DO CÂNCER DE COLO DE ÚTERO E MAMA
0102010340;INSPEÇÃO SANITÁRIA DE SERVIÇOS DE DIAGNÓSTICO E TRATAMENTO DO CÂNCER DE COLO DE ÚTERO E MAMA.
0102010358;LICENCIAMENTO SANITÁRIO DE SERVIÇOS DE DIAGNÓSTICO E TRATAMENTO DO CÂNCER DE COLO DE ÚTERO E MAMA
0102010366;CADASTRO DE SERVIÇOS HOSPITALARES DE ATENÇÃO AO PARTO E - CRIANÇA
0102010374;INSPEÇÃO SANITÁRIA DE SERVIÇOS HOSPITALARES DE ATENÇÃO AO PARTO E - CRIANÇA
0102010382;LICENCIAMENTO SANITÁRIO DE SERVIÇOS HOSPITALARES DE ATENÇÃO AO PARTO E - CRIANÇA
0102010390;CADASTRO DE SERVIÇOS DE HEMOTERAPIA
0102010404;INSPEÇÃO SANITÁRIA DE SERVIÇOS DE HEMOTERAPIA
0102010412;LICENCIAMENTO SANITÁRIO DE SERVIÇOS DE HEMOTERAPIA
0102010420;CADASTRO DE SERVIÇOS DE TERAPIA RENAL SUBSTITUTIVA
0102010439;INSPEÇÃO SANITÁRIA DE SERVIÇOS DE TERAPIA RENAL SUBSTITUTIVA
0102010447;LICENCIAMENTO SANITÁRIO DE SERVIÇOS DE TERAPIA RENAL SUBSTITUTIVA
0102010455;CADASTRO DE SERVIÇOS DE ALIMENTAÇÃO
0102010463;INSPEÇÃO SANITÁRIA DE SERVIÇOS DE ALIMENTAÇÃO
0102010471;LICENCIAMENTO SANITÁRIO DE SERVIÇOS DE ALIMENTAÇÃO
0102010480;FISCALIZAÇÃO DO USO DE PRODUTOS FUMÍGENOS DERIVADOS DO TABACO EM AMBIENTES COLETIVOS FECHADOS, PÚBLI
0102010498;LAUDO DE ANÁLISE LABORATORIAL DO PROGRAMA DE MONITORAMENTO DE ALIMENTOS RECEBIDOS PELA VIGILÂNCIA SA
0102010501;ATIVIDADES EDUCATIVAS SOBRE A TEMÁTICA DA DENGUE,REALIZADAS PARA A POPULAÇÃO
0102010510;ATIVIDADES EDUCATIVAS,COM RELAÇÃO AO CONSUMO DE SÓDIO, AÇÚCAR E GORDURAS, REALIZADAS PARA O SETOR RE
0102010528;INSTAURAÇÃO DE PROCESSO ADMINISTRATIVO SANITÁRIO
0102010536;CONCLUSÇO DE PROCESSO ADMINISTRATIVO SANITÁRIO
0102010544;CADASTRO DE INDÚSTRIAS DE INSUMOS FARMACÊUTICOS
0102010552;CADASTRO DE INDÚSTRIAS DE PRODUTOS PARA SAÚDE
0102010560;INSPEÇÃO SANITÁRIA DE INDÚSTRIAS DE INSUMOS FARMACÊUTICOS
0102010579;INSPEÇÃO SANITÁRIA DE INDÚSTRIAS DE PRODUTOS PARA SAÚDE
0102010587;IMPLEMENTAÇÃO DE PROCEDIMENTOS (POPS) HARMONIZADOS EM NÍVEL TRIPARTITE RELACIONADOS - INSPEÇÃO EM ES
0102010595;IMPLEMENTAÇÃO DE PROCEDIMENTOS (POPS) HARMONIZADOS EM NÍVEL TRIPARTITE RELACIONADOS - INSPEÇÃO EM ES
0102010609;IMPLEMENTAÇÃO DE PROCEDIMENTOS (POPS) HARMONIZADOS EM NÍVEL TRIPARTITE RELACIONADOS A INSPEÇÃO EM ES
0102010617;ENVIO DE RELATÓRIOS DE INSPEÇÃO DE ESTABELECIMENTOS FABRICANTES DE MEDICAMENTOS - ANVISA
0102010625;ENVIO DE RELATÓRIOS DE INSPEÇÃO DE ESTABELECIMENTOS FABRICANTES DE INSUMOS FARMACÊUTICOS - ANVISA
0102010633;ENVIO DE RELATÓRIOS DE INSPEÇÃO DE ESTABELECIMENTOS FABRICANTES DE PRODUTOS PARA SAÚDE - ANVISA
0102010641;AUDITORIAS INTERNAS REALIZADAS NO DEPARTAMENTO RESPONSÁVEL PELAS ATIVIDADES DE INSPEÇÃO DE ESTABELEC
0102010650;AUDITORIAS INTERNAS REALIZADAS NO DEPARTAMENTO RESPONSÁVEL PELAS ATIVIDADES DE INSPEÇÃO DE ESTABELEC
0102010668;AUDITORIAS INTERNAS REALIZADAS NO DEPARTAMENTO RESPONSÁVEL PELAS ATIVIDADES DE INSPEÇÃO DE ESTABELEC
0102020019;VIGILÂNCIA DA SITUAÇÃO DE SAÚDE DOS TRABALHADORES
0102020027;ATIVIDADE EDUCATIVA EM SAÚDE DO TRABALHADOR
0102020035;INSPEÇÃO SANITÁRIA EM SAÚDE DO TRABALHADOR
0201010011;AMNIOCENTESE
0201010020;BIOPSIA / PUNCAO DE TUMOR SUPERFICIAL DA PELE
0201010038;BIOPSIA CIRURGICA DE TIREOIDE
0201010046;BIOPSIA DE ANUS E CANAL ANAL
0201010054;BIOPSIA DE BACO POR PUNCAO / ASPIRACAO
0201010062;BIOPSIA DE BEXIGA
0201010070;BIOPSIA DE BOLSA ESCROTAL
0201010089;BIOPSIA DE CONDUTO AUDITIVO EXTERNO
0201010097;BIOPSIA DE CONJUNTIVA
0201010100;BIOPSIA DE CORDAO ESPERMATICO (UNILATERAL)
0201010119;BIOPSIA DE CORNEA
0201010127;BIOPSIA DE CORPO VERTEBRAL A CEU ABERTO
0201010135;BIOPSIA DE CORPO VERTEBRAL LAMINA E PEDICULO VERTEBRAL (POR DISPOSITIVO GUIADO)
0201010143;BIOPSIA DE ENDOCARDIO / MIOCARDIO
0201010151;BIOPSIA DE ENDOMETRIO
0201010160;BIOPSIA DE ENDOMETRIO POR ASPIRACAO MANUAL INTRA-UTERINA
0201010178;BIOPSIA DE EPIDIDIMO
0201010186;BIOPSIA DE ESCLERA
0201010194;BIOPSIA DE FARINGE/LARINGE
0201010208;BIOPSIA DE FIGADO EM CUNHA / FRAGMENTO
0201010216;BIOPSIA DE FIGADO POR PUNCAO
0201010224;BIOPSIA DE GANGLIO LINFATICO
0201010232;BIÓPSIA DE GLÂNDULA SALIVAR
0201010240;BIOPSIA DE IRIS, CORPO CILIAR, RETINA, COROIDE, VITREO E TUMOR INTRA OCULAR
0201010259;BIOPSIA DE LAMINA PEDICULO E PROCESSOS VERTEBRAIS (A CEU ABERTO)
0201010267;BIOPSIA DE LESAO DE PARTES MOLES (POR AGULHA / CEU ABERTO)
0201010275;BIOPSIA DE MEDULA OSSEA
0201010283;BIOPSIA DE MUSCULO (A CEU ABERTO)
0201010291;BIOPSIA DE NERVO
0201010305;BIOPSIA DE OSSO / CARTILAGEM DA CINTURA ESCAPULAR (POR AGULHA / CEU ABERTO)
0201010313;BIOPSIA DE OSSO / CARTILAGEM DA CINTURA PELVICA (POR AGULHA / CEU ABERTO)
0201010321;BIOPSIA DE OSSO / CARTILAGEM DE MEMBRO INFERIOR (POR AGULHA / CEU ABERTO)
0201010330;BIOPSIA DE OSSO / CARTILAGEM DE MEMBRO SUPERIOR (POR AGULHA / CEU ABERTO)
0201010348;BIÓPSIA DE OSSO DO CRÂNIO E DA FACE
0201010356;BIOPSIA DE PALPEBRA
0201010364;BIOPSIA DE PAVILHAO AURICULAR
0201010372;BIOPSIA DE PELE E PARTES MOLES
0201010380;BIOPSIA DE PENIS
0201010399;BIOPSIA DE PIRAMIDE NASAL
0201010402;BIOPSIA DE PLEURA (POR ASPIRAÇÃO/AGULHA / PLEUROSCOPIA)
0201010410;BIOPSIA DE PROSTATA
0201010429;BIOPSIA DE PULMAO POR ASPIRACAO
0201010437;BIOPSIA DE RIM POR PUNCAO
0201010445;BIOPSIA DE SEIO PARANASAL
0201010453;BIOPSIA DE SINOVIA
0201010461;BIOPSIA DE TESTICULO
0201010470;BIOPSIA DE TIREOIDE OU PARATIREOIDE - PAAF
0201010488;BIOPSIA DE URETER
0201010496;BIOPSIA DE URETRA
0201010500;BIOPSIA/PUNÇÃO DE VAGINA
0201010518;BIOPSIA/PUNÇÃO DE VULVA
0201010526;BIÓPSIA DOS TECIDOS MOLES DA BOCA
0201010534;BIOPSIA ESTEREOTAXICA
0201010542;BIOPSIA PERCUTANEA ORIENTADA POR TOMOGRAFIA COMPUTADORIZADA / ULTRASSONOGRAFIA / RESSONANCIA MAGNETI
0201010550;BIOPSIA PRE-ESCALENICA
0201010569;BIOPSIA/EXERESE DE NODULO DE MAMA
0201010577;BIOPSIAS MULTIPLAS P/ ESTADIAMENTO
0201010585;PUNCAO ASPIRATIVA DE MAMA POR AGULHA FINA
0201010593;PUNCAO DE CISTERNA SUB-OCCIPITAL
0201010607;PUNCAO DE MAMA POR AGULHA GROSSA
0201010615;PUNCAO DE VAGINA
0201010623;PUNCAO EXPLORADORA DO DEFERENTE
0201010631;PUNCAO LOMBAR
0201010640;PUNCAO P/ ESVAZIAMENTO
0201010658;PUNCAO VENTRICULAR TRANSFONTANELA
0201010666;BIOPSIA DO COLO UTERINO
0201020017;COLETA DE LAVADO BRONCO-ALVEOLAR
0201020025;COLETA DE LINFA P/ PESQUISA DE M. LEPRAE
0201020033;COLETA DE MATERIAL P/ EXAME CITOPATOLOGICO DE COLO UTERINO
0201020041;COLETA DE MATERIAL P/ EXAME LABORATORIAL
0201020050;COLETA DE SANGUE P/ TRIAGEM NEONATAL
0201020068;COLETA DE SANGUE PARA TIPIFICAÇÃO DO ALELO HLA-B
0202010015;CLEARANCE OSMOLAR
0202010023;DETERMINACAO DE CAPACIDADE DE FIXACAO DO FERRO
0202010031;DETERMINACAO DE CROMATOGRAFIA DE AMINOACIDOS
0202010040;DETERMINACAO DE CURVA GLICEMICA (2 DOSAGENS)
0202010058;DETERMINACAO DE CURVA GLICEMICA C/ INDUCAO POR CORTISONA ( 5 DOSAGENS)
0202010066;DETERMINACAO DE CURVA GLICEMICA C/ INDUCAO POR CORTISONA (4 DOSAGENS)
0202010074;DETERMINACAO DE CURVA GLICEMICA CLASSICA (5 DOSAGENS)
0202010082;DETERMINACAO DE OSMOLARIDADE
0202010090;DOSAGEM DE 5-NUCLEOTIDASE
0202010104;DOSAGEM DE ACETONA
0202010112;DOSAGEM DE ACIDO ASCORBICO
0202010120;DOSAGEM DE ACIDO URICO
0202010139;DOSAGEM DE ACIDO VANILMANDELICO
0202010147;DOSAGEM DE ALDOLASE
0202010155;DOSAGEM DE ALFA-1-ANTITRIPSINA
0202010163;DOSAGEM DE ALFA-1-GLICOPROTEINA ACIDA
0202010171;DOSAGEM DE ALFA-2-MACROGLOBULINA
0202010180;DOSAGEM DE AMILASE
0202010198;DOSAGEM DE AMONIA
0202010201;DOSAGEM DE BILIRRUBINA TOTAL E FRACOES
0202010210;DOSAGEM DE CALCIO
0202010228;DOSAGEM DE CALCIO IONIZAVEL
0202010236;DOSAGEM DE CAROTENO
0202010244;DOSAGEM DE CATECOLAMINAS
0202010252;DOSAGEM DE CERULOPLASMINA
0202010260;DOSAGEM DE CLORETO
0202010279;DOSAGEM DE COLESTEROL HDL
0202010287;DOSAGEM DE COLESTEROL LDL
0202010295;DOSAGEM DE COLESTEROL TOTAL
0202010309;DOSAGEM DE COLINESTERASE
0202010317;DOSAGEM DE CREATININA
0202010325;DOSAGEM DE CREATINOFOSFOQUINASE (CPK)
0202010333;DOSAGEM DE CREATINOFOSFOQUINASE FRACAO MB
0202010341;DOSAGEM DE DESIDROGENASE ALFA-HIDROXIBUTIRICA
0202010350;DOSAGEM DE DESIDROGENASE GLUTAMICA
0202010368;DOSAGEM DE DESIDROGENASE LATICA
0202010376;DOSAGEM DE DESIDROGENASE LATICA (ISOENZIMAS FRACIONADAS)
0202010384;DOSAGEM DE FERRITINA
0202010392;DOSAGEM DE FERRO SERICO
0202010406;DOSAGEM DE FOLATO
0202010414;DOSAGEM DE FOSFATASE ACIDA TOTAL
0202010422;DOSAGEM DE FOSFATASE ALCALINA
0202010430;DOSAGEM DE FOSFORO
0202010449;DOSAGEM DE FRACAO PROSTATICA DA FOSFATASE ACIDA
0202010457;DOSAGEM DE GALACTOSE
0202010465;DOSAGEM DE GAMA-GLUTAMIL-TRANSFERASE (GAMA GT)
0202010473;DOSAGEM DE GLICOSE
0202010481;DOSAGEM DE GLICOSE-6-FOSFATO DESIDROGENASE
0202010490;DOSAGEM DE HAPTOGLOBINA
0202010503;DOSAGEM DE HEMOGLOBINA GLICOSILADA
0202010511;DOSAGEM DE HIDROXIPROLINA
0202010520;DOSAGEM DE ISOMERASE-FOSFOHEXOSE
0202010538;DOSAGEM DE LACTATO
0202010546;DOSAGEM DE LEUCINO-AMINOPEPTIDASE
0202010554;DOSAGEM DE LIPASE
0202010562;DOSAGEM DE MAGNESIO
0202010570;DOSAGEM DE MUCO-PROTEINAS
0202010589;DOSAGEM DE PIRUVATO
0202010597;DOSAGEM DE PORFIRINAS
0202010600;DOSAGEM DE POTASSIO
0202010619;DOSAGEM DE PROTEINAS TOTAIS
0202010627;DOSAGEM DE PROTEINAS TOTAIS E FRACOES
0202010635;DOSAGEM DE SODIO
0202010643;DOSAGEM DE TRANSAMINASE GLUTAMICO-OXALACETICA (TGO)
0202010651;DOSAGEM DE TRANSAMINASE GLUTAMICO-PIRUVICA (TGP)
0202010660;DOSAGEM DE TRANSFERRINA
0202010678;DOSAGEM DE TRIGLICERIDEOS
0202010686;DOSAGEM DE TRIPTOFANO
0202010694;DOSAGEM DE UREIA
0202010708;DOSAGEM DE VITAMINA B12
0202010716;ELETROFORESE DE LIPOPROTEINAS
0202010724;ELETROFORESE DE PROTEINAS
0202010732;GASOMETRIA (PH PCO2 PO2 BICARBONATO AS2 (EXCESSO OU DEFICIT BASE )
0202010740;PROVA DA D-XILOSE
0202010759;TESTE DE TOLERANCIA A INSULINA / HIPOGLICEMIANTES ORAIS
0202010767;DOSAGEM DE 25 HIDROXIVITAMINA D
0202010775;DETERMINAÇÃO DE CREMATÓCRITO NO LEITE HUMANO ORDENHADO
0202010783;ACIDEZ TITULÁVEL NO LEITE HUMANO (DORNIC)
0202020010;CITOQUIMICA HEMATOLOGICA
0202020029;CONTAGEM DE PLAQUETAS
0202020037;CONTAGEM DE RETICULOCITOS
0202020045;DETERMINACAO DE CURVA DE RESISTENCIA GLOBULAR
0202020053;DETERMINACAO DE ENZIMAS ERITROCITARIAS (CADA)
0202020061;DETERMINACAO DE SULFO-HEMOGLOBINA
0202020070;DETERMINACAO DE TEMPO DE COAGULACAO
0202020088;DETERMINACAO DE TEMPO DE LISE DA EUGLOBULINA
0202020096;DETERMINACAO DE TEMPO DE SANGRAMENTO -DUKE
0202020100;DETERMINACAO DE TEMPO DE SANGRAMENTO DE IVY
0202020118;DETERMINACAO DE TEMPO DE SOBREVIDA DE HEMACIAS
0202020126;DETERMINACAO DE TEMPO DE TROMBINA
0202020134;DETERMINACAO DE TEMPO DE TROMBOPLASTINA PARCIAL ATIVADA (TTP ATIVADA)
0202020142;DETERMINACAO DE TEMPO E ATIVIDADE DA PROTROMBINA (TAP)
0202020150;DETERMINACAO DE VELOCIDADE DE HEMOSSEDIMENTACAO (VHS)
0202020169;DOSAGEM DE ANTICOAGULANTE CIRCULANTE
0202020177;DOSAGEM DE ANTITROMBINA III
0202020185;DOSAGEM DE FATOR II
0202020193;DOSAGEM DE FATOR IX
0202020207;DOSAGEM DE FATOR V
0202020215;DOSAGEM DE FATOR VII
0202020223;DOSAGEM DE FATOR VIII
0202020231;DOSAGEM DE FATOR VIII (INIBIDOR)
0202020240;DOSAGEM DE FATOR VON WILLEBRAND (ANTIGENO)
0202020258;DOSAGEM DE FATOR X
0202020266;DOSAGEM DE FATOR XI
0202020274;DOSAGEM DE FATOR XII
0202020282;DOSAGEM DE FATOR XIII
0202020290;DOSAGEM DE FIBRINOGENIO
0202020304;DOSAGEM DE HEMOGLOBINA
0202020312;DOSAGEM DE HEMOGLOBINA - INSTABILIDADE A 37OC
0202020320;DOSAGEM DE HEMOGLOBINA FETAL
0202020339;DOSAGEM DE HEMOSSIDERINA
0202020347;DOSAGEM DE PLASMINOGENIO
0202020355;ELETROFORESE DE HEMOGLOBINA
0202020363;ERITROGRAMA (ERITROCITOS, HEMOGLOBINA, HEMATOCRITO)
0202020371;HEMATOCRITO
0202020380;HEMOGRAMA COMPLETO
0202020398;LEUCOGRAMA
0202020401;PESQUISA DE ATIVIDADE DO COFATOR DE RISTOCETINA
0202020410;PESQUISA DE CELULAS LE
0202020428;PESQUISA DE CORPUSCULOS DE HEINZ
0202020436;PESQUISA DE FILARIA
0202020444;PESQUISA DE HEMOGLOBINA S
0202020452;PESQUISA DE PLASMODIO
0202020460;PESQUISA DE TRIPANOSSOMA
0202020479;PROVA DE COMPATIBILIDADE PRE-TRANSFUSIONAL (MEIOS SALINOS, ALBUMINOSO E COOMBS)
0202020487;PROVA DE CONSUMO DE PROTROMBINA
0202020495;PROVA DE RETRACAO DO COAGULO
0202020509;PROVA DO LACO
0202020517;RASTREIO P/ DEFICIENCIA DE ENZIMAS ERITROCITARIAS
0202020525;TESTE DE AGREGACAO DE PLAQUETAS
0202020533;TESTE DE HAM (HEMOLISE ACIDA)
0202020541;TESTE DIRETO DE ANTIGLOBULINA HUMANA (TAD)
0202030016;CONTAGEM DE LINFOCITOS B
0202030024;CONTAGEM DE LINFOCITOS CD4/CD8
0202030032;CONTAGEM DE LINFOCITOS T TOTAIS
0202030040;DETECCAO DE ÁCIDOS NUCLEICOS DO HIV-1 (QUALITATIVO)
0202030059;DETECCAO DE RNA DO VIRUS DA HEPATITE C (QUALITATIVO)
0202030067;DETERMINACAO DE COMPLEMENTO (CH50)
0202030075;DETERMINACAO DE FATOR REUMATOIDE
0202030083;DETERMINACAO QUANTITATIVA DE PROTEINA C REATIVA
0202030091;DOSAGEM DE ALFA-FETOPROTEINA
0202030105;DOSAGEM DE ANTIGENO PROSTATICO ESPECIFICO (PSA)
0202030113;DOSAGEM DE BETA-2-MICROGLOBULINA
0202030121;DOSAGEM DE COMPLEMENTO C3
0202030130;DOSAGEM DE COMPLEMENTO C4
0202030148;DOSAGEM DE CRIOAGLUTININA
0202030156;DOSAGEM DE IMUNOGLOBULINA A (IGA)
0202030164;DOSAGEM DE IMUNOGLOBULINA E (IGE)
0202030172;DOSAGEM DE IMUNOGLOBULINA G (IGG)
0202030180;DOSAGEM DE IMUNOGLOBULINA M (IGM)
0202030199;DOSAGEM DE INIBIDOR DE C1-ESTERASE
0202030202;DOSAGEM DE PROTEINA C REATIVA
0202030210;GENOTIPAGEM DE VIRUS DA HEPATITE C
0202030229;IMUNOELETROFORESE DE PROTEINAS
0202030237;IMUNOFENOTIPAGEM DE HEMOPATIAS MALIGNAS (POR MARCADOR)
0202030245;INTRADERMORREACAO COM DERIVADO PROTEICO PURIFICADO (PPD)
0202030253;PESQUISA DE ANTICORPO IGG ANTICARDIOLIPINA
0202030261;PESQUISA DE ANTICORPO IGM ANTICARDIOLIPINA
0202030270;PESQUISA DE ANTICORPOS ANTI-DNA
0202030288;PESQUISA DE ANTICORPOS ANTI-HELICOBACTER PYLORI
0202030296;PESQUISA DE ANTICORPOS ANTI-HIV-1 (WESTERN BLOT)
0202030300;PESQUISA DE ANTICORPOS ANTI-HIV-1 + HIV-2 (ELISA)
0202030318;PESQUISA DE ANTICORPOS ANTI-HTLV-1 + HTLV-2
0202030326;PESQUISA DE ANTICORPOS ANTI-RIBONUCLEOPROTEINA (RNP)
0202030334;PESQUISA DE ANTICORPOS ANTI-SCHISTOSOMAS
0202030342;PESQUISA DE ANTICORPOS ANTI-SM
0202030350;PESQUISA DE ANTICORPOS ANTI-SS-A (RO)
0202030369;PESQUISA DE ANTICORPOS ANTI-SS-B (LA)
0202030377;PESQUISA DE ANTICORPOS ANTIADENOVIRUS
0202030385;PESQUISA DE ANTICORPOS ANTIAMEBAS
0202030393;PESQUISA DE ANTICORPOS ANTIASPERGILLUS
0202030407;PESQUISA DE ANTICORPOS ANTIBRUCELAS
0202030415;PESQUISA DE ANTICORPOS ANTICISTICERCO
0202030423;PESQUISA DE ANTICORPOS ANTICLAMIDIA (POR IMUNOFLUORESCENCIA)
0202030431;PESQUISA DE ANTICORPOS ANTICORTEX SUPRARENAL
0202030440;PESQUISA DE ANTICORPOS ANTIEQUINOCOCOS
0202030458;PESQUISA DE ANTICORPOS ANTIESCLERODERMA (SCL 70)
0202030466;PESQUISA DE ANTICORPOS ANTIESPERMATOZOIDES
0202030474;PESQUISA DE ANTICORPOS ANTIESTREPTOLISINA O (ASLO)
0202030482;PESQUISA DE ANTICORPOS ANTIFIGADO
0202030490;PESQUISA DE ANTICORPOS ANTIGLIADINA (GLUTEN) IGG IGM E IGA
0202030504;PESQUISA DE ANTICORPOS ANTIGLOMERULO
0202030512;PESQUISA DE ANTICORPOS ANTIILHOTA DE LANGERHANS
0202030520;PESQUISA DE ANTICORPOS ANTIINSULINA
0202030539;PESQUISA DE ANTICORPOS ANTILEPTOSPIRAS
0202030547;PESQUISA DE ANTICORPOS ANTILISTERIA
0202030555;PESQUISA DE ANTICORPOS ANTIMICROSSOMAS
0202030563;PESQUISA DE ANTICORPOS ANTIMITOCONDRIA
0202030571;PESQUISA DE ANTICORPOS ANTIMUSCULO ESTRIADO
0202030580;PESQUISA DE ANTICORPOS ANTIMUSCULO LISO
0202030598;PESQUISA DE ANTICORPOS ANTINUCLEO
0202030601;PESQUISA DE ANTICORPOS ANTIPARIETAIS
0202030610;PESQUISA DE ANTICORPOS ANTIPLASMODIOS
0202030628;PESQUISA DE ANTICORPOS ANTITIREOGLOBULINA
0202030636;PESQUISA DE ANTICORPOS CONTRA ANTIGENO DE SUPERFICIE DO VIRUS DA HEPATITE B (ANTI-HBS)
0202030644;PESQUISA DE ANTICORPOS CONTRA ANTIGENO E DO VIRUS DA HEPATITE B (ANTI-HBE)
0202030652;PESQUISA DE ANTICORPOS CONTRA HISTOPLASMA
0202030660;PESQUISA DE ANTICORPOS CONTRA O SPOROTRIX SCHENKII
0202030679;PESQUISA DE ANTICORPOS CONTRA O VIRUS DA HEPATITE C (ANTI-HCV)
0202030687;PESQUISA DE ANTICORPOS CONTRA O VIRUS DA HEPATITE D (ANTI-HDV)
0202030695;PESQUISA DE ANTICORPOS CONTRA O VIRUS DO SARAMPO
0202030709;PESQUISA DE ANTICORPOS CONTRA PARACOCCIDIOIDES BRASILIENSIS
0202030717;PESQUISA DE ANTICORPOS E/OU ANTIGENO DO VIRUS SINCICIAL RESPIRATORIO
0202030725;PESQUISA DE ANTICORPOS EIE ANTICLAMIDIA
0202030733;PESQUISA DE ANTICORPOS HETEROFILOS CONTA O VIRUS EPSTEIN-BARR
0202030741;PESQUISA DE ANTICORPOS IGG ANTICITOMEGALOVIRUS
0202030750;PESQUISA DE ANTICORPOS IGG ANTILEISHMANIAS
0202030768;PESQUISA DE ANTICORPOS IGG ANTITOXOPLASMA
0202030776;PESQUISA DE ANTICORPOS IGG ANTITRYPANOSOMA CRUZI
0202030784;PESQUISA DE ANTICORPOS IGG E IGM CONTRA ANTIGENO CENTRAL DO VIRUS DA HEPATITE B (ANTI-HBC-TOTAL)
0202030792;PESQUISA DE ANTICORPOS IGG CONTRA ARBOVIRUS
0202030806;PESQUISA DE ANTICORPOS IGG CONTRA O VIRUS DA HEPATITE A (HAV-IGG)
0202030814;PESQUISA DE ANTICORPOS IGG CONTRA O VIRUS DA RUBEOLA
0202030822;PESQUISA DE ANTICORPOS IGG CONTRA O VIRUS DA VARICELA-HERPES ZOSTER
0202030830;PESQUISA DE ANTICORPOS IGG CONTRA O VIRUS EPSTEIN-BARR
0202030849;PESQUISA DE ANTICORPOS IGG CONTRA O VIRUS HERPES SIMPLES
0202030857;PESQUISA DE ANTICORPOS IGM ANTICITOMEGALOVIRUS
0202030865;PESQUISA DE ANTICORPOS IGM ANTILEISHMANIAS
0202030873;PESQUISA DE ANTICORPOS IGM ANTITOXOPLASMA
0202030881;PESQUISA DE ANTICORPOS IGM ANTITRYPANOSOMA CRUZI
0202030890;PESQUISA DE ANTICORPOS IGM CONTRA ANTIGENO CENTRAL DO VIRUS DA HEPATITE B (ANTI-HBC-IGM)
0202030903;PESQUISA DE ANTICORPOS IGM CONTRA ARBOVIRUS
0202030911;PESQUISA DE ANTICORPOS IGM CONTRA O VIRUS DA HEPATITE A (HAV-IGG)
0202030920;PESQUISA DE ANTICORPOS IGM CONTRA O VIRUS DA RUBEOLA
0202030938;PESQUISA DE ANTICORPOS IGM CONTRA O VIRUS DA VARICELA-HERPES ZOSTER
0202030946;PESQUISA DE ANTICORPOS IGM CONTRA O VIRUS EPSTEIN-BARR
0202030954;PESQUISA DE ANTICORPOS IGM CONTRA O VIRUS HERPES SIMPLES
0202030962;PESQUISA DE ANTIGENO CARCINOEMBRIONARIO (CEA)
0202030970;PESQUISA DE ANTIGENO DE SUPERFICIE DO VIRUS DA HEPATITE B (HBSAG)
0202030989;PESQUISA DE ANTIGENO E DO VIRUS DA HEPATITE B (HBEAG)
0202030997;DETECÇÃO DE CLAMÍDIA E GONOCOCO POR BIOLOGIA MOLECULAR
0202031004;PESQUISA DE CRIOGLOBULINAS
0202031012;PESQUISA DE FATOR REUMATOIDE (WAALER-ROSE)
0202031020;PESQUISA DE HIV-1 POR IMUNOFLUORESCENCIA
0202031039;PESQUISA DE IMUNOGLOBULINA E (IGE) ALERGENO-ESPECIFICA
0202031047;PESQUISA DE TRYPANOSOMA CRUZI (POR IMUNOFLUORESCENCIA)
0202031055;PROVAS DE PRAUSNITZ-KUSTNER (PK)
0202031063;PROVAS IMUNO-ALERGICAS BACTERIANAS
0202031071;QUANTIFICACAO DE RNA DO HIV-1
0202031080;QUANTIFICACAO DE RNA DO VIRUS DA HEPATITE C
0202031098;TESTE TREPONEMICO P/ DETECÇÃO DE SIFILIS
0202031101;REACAO DE MONTENEGRO ID
0202031110;TESTE NÇO TREPONEMICO P/ DETECÇÃO DE SIFILIS
0202031128;TESTE FTA-ABS IGG P/ DIAGNOSTICO DA SIFILIS
0202031136;TESTE FTA-ABS IGM P/ DIAGNOSTICO DA SIFILIS
0202031144;TESTES ALERGICOS DE CONTATO
0202031152;TESTES CUTANEOS DE LEITURA IMEDIATA
0202031160;TESTES RAPIDOS P/ DIAGNOSTICO DA SIFILIS
0202031179;TESTE NÇO TREPONEMICO P/ DETECÇÃO DE SIFILIS EM GESTANTES
0202031187;DOSAGEM DE ANTICORPOS ANTITRANSGLUTAMINAISE RECOMBINANTE HUMANO IGA
0202031195;DOSAGEM DA FRAÇÃO C1Q DO COMPLEMENTO
0202031209;DOSAGEM DE TROPONINA
0202031217;DOSAGEM DO ANTÍGENO CA 125
0202031225;EXAME LABORATORIAL PARA DOENÇA DE GAUCHER I
0202031233;EXAME LABORATORIAL PARA DOENÇA DE GAUCHER II
0202031241;GENOTIPAGEM DO HIV
0202031250;DETECÇÃO DE RNA DO HTLV-1
0202031268;PESQUISA DE ANTICORPOS ANTICORPOS ANTI-HTLV-1 (WESTERN-BLOT)
0202040011;DOSAGEM DE ESTERCOBILINOGENIO FECAL
0202040020;DOSAGEM DE GORDURA FECAL
0202040038;EXAME COPROLOGICO FUNCIONAL
0202040046;IDENTIFICACAO DE FRAGMENTOS DE HELMINTOS
0202040054;PESQUISA DE ENTEROBIUS VERMICULARES (OXIURUS OXIURA)
0202040062;PESQUISA DE EOSINOFILOS
0202040070;PESQUISA DE GORDURA FECAL
0202040089;PESQUISA DE LARVAS NAS FEZES
0202040097;PESQUISA DE LEUCOCITOS NAS FEZES
0202040100;PESQUISA DE LEVEDURAS NAS FEZES
0202040119;PESQUISA DE OVOS DE SCHISTOSOMAS (EM FRAGMENTO DE MUCOSA)
0202040127;PESQUISA DE OVOS E CISTOS DE PARASITAS
0202040135;PESQUISA DE ROTAVIRUS NAS FEZES
0202040143;PESQUISA DE SANGUE OCULTO NAS FEZES
0202040151;PESQUISA DE SUBSTANCIAS REDUTORAS NAS FEZES
0202040160;PESQUISA DE TRIPSINA NAS FEZES
0202040178;PESQUISA DE TROFOZOITAS NAS FEZES
0202050017;ANALISE DE CARACTERES FISICOS, ELEMENTOS E SEDIMENTO DA URINA
0202050025;CLEARANCE DE CREATININA
0202050033;CLEARANCE DE FOSFATO
0202050041;CLEARANCE DE UREIA
0202050050;CONTAGEM DE ADDIS
0202050068;DETERMINACAO DE OSMOLALIDADE
0202050076;IDENTIFICAÇÃO DE GLICÍDIOS URINÁRIOS POR CROMATOGRAFIA (CAMADA DELGADA)
0202050084;DOSAGEM DE CITRATO
0202050092;DOSAGEM DE MICROALBUMINA NA URINA
0202050106;DOSAGEM DE OXALATO
0202050114;DOSAGEM DE PROTEINAS (URINA DE 24 HORAS)
0202050122;DOSAGEM E/OU FRACIONAMENTO DE ACIDOS ORGANICOS
0202050130;EXAME QUALITATIVO DE CALCULOS URINARIOS
0202050149;PESQUISA / DOSAGEM DE AMINOACIDOS (POR CROMATOGRAFIA)
0202050157;PESQUISA DE ALCAPTONA NA URINA
0202050165;PESQUISA DE AMINOACIDOS NA URINA
0202050173;PESQUISA DE BETA-MERCAPTO-LACTATO-DISSULFIDURIA
0202050181;PESQUISA DE CADEIAS LEVES KAPPA E LAMBDA
0202050190;PESQUISA DE CISTINA NA URINA
0202050203;PESQUISA DE COPROPORFIRINA NA URINA
0202050211;PESQUISA DE ERROS INATOS DO METABOLISMO NA URINA
0202050220;PESQUISA DE FENIL-CETONA NA URINA
0202050238;PESQUISA DE FRUTOSE NA URINA
0202050246;PESQUISA DE GALACTOSE NA URINA
0202050254;PESQUISA DE GONADOTROFINA CORIONICA
0202050262;PESQUISA DE HOMOCISTINA NA URINA
0202050270;PESQUISA DE LACTOSE NA URINA
0202050289;PESQUISA DE MUCOPOLISSACARIDEOS NA URINA
0202050297;PESQUISA DE PORFOBILINOGENIO NA URINA
0202050300;PESQUISA DE PROTEINAS URINARIAS (POR ELETROFORESE)
0202050319;PESQUISA DE TIROSINA NA URINA
0202050327;PROVA DE DILUICAO (URINA)
0202060012;DETERMINACAO DE INDICE DE TIROXINA LIVRE
0202060020;DETERMINACAO DE RETENCAO DE T3
0202060039;DETERMINACAO DE T3 REVERSO
0202060047;DOSAGEM DE 17-ALFA-HIDROXIPROGESTERONA
0202060055;DOSAGEM DE 17-CETOSTEROIDES TOTAIS
0202060063;DOSAGEM DE 17-HIDROXICORTICOSTEROIDES
0202060071;DOSAGEM DE ACIDO 5-HIDROXI-INDOL-ACETICO (SEROTONINA)
0202060080;DOSAGEM DE ADRENOCORTICOTROFICO (ACTH)
